{
  "app": {
    "id": "paperless-sync",
    "name": "Paperless Sync",
    "version": "0.5.0",
    "type": "platform",
    "description": "Sync your paperless-ngx document archive into the Cortex knowledge graph — the full original documents, on demand or on a schedule, fully server-side",
    "publisher": {
      "name": "reneil",
      "url": "https://github.com/mocaOS"
    },
    "icon": "icon.svg",
    "entry": "index.html",
    "cortex": {
      "minVersion": "2.1.0",
      "keyScope": "read_write",
      "endpoints": [
        "upload",
        "documents",
        "collections"
      ],
      "collections": "all"
    },
    "config": [
      {
        "name": "PAPERLESS_BASE_URL",
        "type": "text",
        "required": true,
        "description": "Base URL of your paperless-ngx instance, e.g. https://paperless.example.com"
      },
      {
        "name": "PAPERLESS_TOKEN",
        "type": "secret",
        "required": true,
        "auth_header": "Authorization: Token PAPERLESS_TOKEN",
        "description": "paperless-ngx API token (My Profile -> API Token). Stored encrypted, injected server-side."
      }
    ],
    "sharing": {
      "links": false
    },
    "users": false,
    "capabilities": {
      "http": {
        "hosts": [
          "${PAPERLESS_BASE_URL}"
        ]
      },
      "tasks": {},
      "storage": {}
    }
  },
  "artifact": {
    "url": "https://github.com/mocaOS/cortex-app-paperless/releases/download/v0.5.0/paperless-sync-0.5.0.zip",
    "sha256": "75533daf913fac92dfa930635111a6b0b820c1a15f4a43f3a799abaa346e3f21",
    "size": 73860
  },
  "repo": "https://github.com/mocaOS/cortex-app-paperless",
  "tags": [
    "documents",
    "paperless-ngx",
    "sync",
    "scheduled"
  ],
  "screenshots": [],
  "listedAt": "2026-07-21",
  "status": "active"
}
