{
  "app": {
    "id": "dropbox-sync",
    "name": "Dropbox Sync",
    "version": "0.2.0",
    "type": "platform",
    "description": "Sync selected Dropbox folders into the Cortex knowledge graph — on demand or on a schedule, fully server-side with OAuth PKCE",
    "publisher": {
      "name": "reneil",
      "url": "https://github.com/mocaOS"
    },
    "icon": "icon.svg",
    "entry": "index.html",
    "cortex": {
      "minVersion": "2.1.0",
      "keyScope": "read_write",
      "endpoints": [
        "upload",
        "documents",
        "collections"
      ],
      "collections": "all"
    },
    "config": [
      {
        "name": "DROPBOX_APP_KEY",
        "type": "text",
        "required": true,
        "description": "App key of a Dropbox scoped app (https://www.dropbox.com/developers/apps). Needs scopes files.metadata.read + files.content.read + account_info.read; PKCE flow, so no app secret is ever required."
      }
    ],
    "externalHosts": [
      "https://api.dropboxapi.com"
    ],
    "sharing": {
      "links": false
    },
    "users": false,
    "capabilities": {
      "http": {
        "hosts": [
          "api.dropboxapi.com",
          "content.dropboxapi.com"
        ]
      },
      "tasks": {},
      "storage": {}
    }
  },
  "artifact": {
    "url": "https://github.com/mocaOS/cortex-app-dropbox/releases/download/v0.2.0/dropbox-sync-0.2.0.zip",
    "sha256": "6d85123c09185abfff65227eb7acc6866c9b7b7a77be98b54f1a2f0ff61c197b",
    "size": 76924
  },
  "repo": "https://github.com/mocaOS/cortex-app-dropbox",
  "tags": [
    "sync",
    "dropbox",
    "oauth",
    "documents"
  ],
  "screenshots": [],
  "listedAt": "2026-07-21",
  "status": "active"
}
