{
  "app": {
    "id": "onedrive-sync",
    "name": "OneDrive Sync",
    "version": "0.2.0",
    "type": "platform",
    "description": "Sync selected OneDrive folders into the Cortex knowledge graph — on demand or on a schedule, fully server-side via Microsoft Graph delta",
    "publisher": {
      "name": "reneil",
      "url": "https://github.com/mocaOS"
    },
    "icon": "icon.svg",
    "entry": "index.html",
    "cortex": {
      "minVersion": "2.1.0",
      "keyScope": "read_write",
      "endpoints": [
        "upload",
        "documents",
        "collections"
      ],
      "collections": "all"
    },
    "config": [
      {
        "name": "ENTRA_CLIENT_ID",
        "type": "text",
        "required": true,
        "description": "Application (client) ID of a Microsoft Entra app registration (free at entra.microsoft.com). Supported account types must include personal Microsoft accounts, and 'Allow public client flows' must be enabled - device-code flow, no client secret needed anywhere."
      }
    ],
    "externalHosts": [
      "https://graph.microsoft.com"
    ],
    "sharing": {
      "links": false
    },
    "users": false,
    "capabilities": {
      "http": {
        "hosts": [
          "login.microsoftonline.com",
          "graph.microsoft.com"
        ]
      },
      "tasks": {},
      "storage": {}
    }
  },
  "artifact": {
    "url": "https://github.com/mocaOS/cortex-app-onedrive/releases/download/v0.2.0/onedrive-sync-0.2.0.zip",
    "sha256": "bb8adc3728847a4669eb7783b697df4ef812712662342709c84c4e2c23614b2a",
    "size": 76985
  },
  "repo": "https://github.com/mocaOS/cortex-app-onedrive",
  "tags": [
    "sync",
    "onedrive",
    "microsoft",
    "documents"
  ],
  "screenshots": [],
  "listedAt": "2026-07-21",
  "status": "active"
}
